<?xml version="1.0" encoding="UTF-8" ?>
<xs:schema xmlns:xs="http://www.w3.org/2001/XMLSchema">
    <xs:element name="biblioteca">
        <xs:complexType>
            <xs:sequence>
                <xs:element name="libros">
                    <xs:complexType>
                        <xs:sequence>
                            <xs:element name="libro" maxOccurs="unbounded">
                                <xs:complexType>
                                    <xs:sequence>
                                        <xs:element name="titulo" type="xs:string"/>
                                        <xs:element name="autor" type="xs:string"/>
                                        <xs:element name="ano_publicacion" type="xs:string"/>
                                        <xs:element name="generos">
                                            <xs:complexType>
                                                <xs:sequence>
                                                    <xs:element name="genero" type="xs:string" maxOccurs="unbounded"/>
                                                </xs:sequence>
                                            </xs:complexType>
                                        </xs:element>
                                        <xs:element name="description_list">
                                            <xs:complexType>
                                                <xs:sequence>
                                                    <xs:element name="description" type="xs:string" minOccurs="2" maxOccurs="unbounded"/>
                                                </xs:sequence>
                                            </xs:complexType>
                                        </xs:element>
                                    </xs:sequence>
                                    <xs:attribute name="ISBN" type="xs:string" use="required"/>
                                </xs:complexType>
                            </xs:element>
                        </xs:sequence>
                    </xs:complexType>
                </xs:element>
            </xs:sequence>
        </xs:complexType>
    </xs:element>
</xs:schema>